{
  "id": "Q-001",
  "stage": "clarify",
  "round": 1,
  "question": "Should filters be personal?",
  "options": [
    "Personal",
    "Shared"
  ],
  "recommended": 0,
  "depends_on": [
    "US-01.AC-01"
  ],
  "status": "answered",
  "asked_at": "2026-01-08T00:00:00Z",
  "answer": "Personal",
  "decided_by": "po@example.test",
  "decided_at": "2026-01-09T00:00:00Z",
  "decision_ref": "D1"
}
